<?xml version="1.0" encoding="UTF-8"?>
<books xmlns:xsi="http://www.w3.org/2001/XMLSchema-instance"
       xsi:noNamespaceSchemaLocation="question4a.xsd">
    
    <book isbn="978-1234567890">
        <title>Question3</title>
        <author title="mr" phone="9800000001" email="hellokitty@gmail.com">
            <name>
                <first>ridesh</first>
                <middle>Rai</middle>
                <last>Maharjan</last>
            </name>
        </author>
        <author phone="9800000002" email="hi@gmail.com">
            <name>
                <first>Sabin</first>
                <last>Ranabista</last>
            </name>
        </author>
        <pageNo>250</pageNo>
        <price currency="USD">500</price>
    </book>

    <book isbn="978-0987654321">
        <title>Advanced XML</title>
        <author title="mrs" phone="9800000003" email="ciao@gmail.com">
            <name>
                <first>Sukarni</first>
                <middle>Tumba</middle>
                <last>Limbu</last>
            </name>
        </author>
        <pageNo>300</pageNo>
        <price currency="NPR">599</price>
    </book>

</books>